title,href,short_description,type,main-page,Unnamed: 5
Getting started with NetLogo,/article/getting-started-with-netlogo,Learn how to install NetLogo on your computer and start creating your models.,walkthrough,True,
What is a primitive?,/article/what-is-a-primitive,This webpage is all about NetLogo's primitives. But what do we mean by primitive? This article summarizes it for you.,answer,False,
Common NetLogo error messages and how to fix them,/article/common-netlogo-error-messages,It is frustrating to figure out what an error message means and how to get rid of it. Read this article to learn about most common NetLogo error messages.,list,True,
What does each color indicate in NetLogo programming,/article/code-colors-in-netlogo,"Some words in a NetLogo code window are blue, some are green, some are brown. Why is this the case? What do those colors indicate?",answer,True,
The first 11 NetLogo primitives to learn,/article/first-11-netlogo-primitives-to-learn,"If you are not sure where to start learning NetLogo, check out this list of the most useful and frequently used primitives in NetLogo. Once you learn these primitives well, you should be able to learn any other primitive easily.",list,False,
Shapes and colors in NetLogo,/article/shapes-and-colors-in-netlogo,"Learn how to customize the look of your models with NetLogo's Turtle Shapes Editor, Link Shapes Editor, and Color Swatches tools.",walkthrough,True,
